{
  "slug": "uizard",
  "name": "Uizard",
  "nameZh": "Uizard",
  "description": "Miro 旗下零门槛 UI 设计工具，Autodesigner 2.0 从提示词生成多屏项目，截图扫描器把截图转可编辑稿、手绘线框扫描器数字化草图，人人可用无学习曲线，免费档起步、Pro $12/月",
  "descriptionEn": "No-barrier UI design tool from Miro: Autodesigner 2.0 generates multi-screen projects from a prompt, a Screenshot Scanner turns screenshots into editable mockups and a Wireframe Scanner digitizes hand-drawn sketches — usable by anyone with no learning curve, free to start, Pro $12/month",
  "descriptionJa": "Miro傘下の学習不要なUIデザインツール。Autodesigner 2.0がプロンプトから複数画面のプロジェクトを生成、スクリーンショットスキャナーが画像を編集可能なモックに、手書きワイヤーフレームスキャナーがスケッチをデジタル化。誰でも使える。無料から、Proは月$12",
  "descriptionEs": "Herramienta de diseño UI sin barreras de Miro: Autodesigner 2.0 genera proyectos multipantalla desde un prompt, un Escáner de Capturas convierte capturas en maquetas editables y un Escáner de Wireframes digitaliza bocetos a mano; usable por cualquiera sin curva de aprendizaje, gratis para empezar, Pro $12/mes",
  "descriptionFr": "Outil de design UI sans barrière signé Miro : Autodesigner 2.0 génère des projets multi-écrans depuis un prompt, un Scanner de captures transforme les captures en maquettes éditables et un Scanner de wireframes numérise les croquis à main levée ; utilisable par tous sans courbe d'apprentissage, gratuit pour démarrer, Pro 12 $/mois",
  "url": "https://uizard.io",
  "logo": "/logos/tools/uizard.png",
  "category": "Design",
  "tags": [
    "Freemium"
  ],
  "featured": false,
  "developer": "Uizard (Miro)",
  "platforms": {
    "web": true,
    "windows": false,
    "macos": false,
    "ios": false,
    "android": false,
    "linux": false,
    "browser_extension": false,
    "api": false
  }
}
