{
  "slug": "workbuddy-cn",
  "name": "WorkBuddy",
  "nameZh": "WorkBuddy 中国版",
  "description": "腾讯云推出的全场景 AI 办公工作台（中国版），多 Agent 并行工作，支持文档处理、数据分析、内容创作等，深度整合腾讯生态",
  "descriptionEn": "Tencent Cloud's full-scenario AI office workbench (China version), with multi-agent parallel work for document processing, data analysis, content creation, deeply integrated with Tencent ecosystem",
  "descriptionJa": "Tencent Cloudの全シナリオAIオフィスワークベンチ（中国版）。マルチエージェント並列作業で文書処理、データ分析、コンテンツ作成をサポート、Tencentエコシステムと深く統合",
  "descriptionEs": "Banco de trabajo de oficina AI de escenario completo de Tencent Cloud (versión China), con trabajo paralelo multiagente para procesamiento de documentos, análisis de datos, creación de contenido, integrado profundamente con el ecosistema Tencent",
  "descriptionFr": "Poste de travail AI tous scénarios de Tencent Cloud (version Chine), avec travail multi-agent parallèle pour le traitement de documents, l'analyse de données, la création de contenu, profondément intégré à l'écosystème Tencent",
  "url": "https://www.workbuddy.cn/",
  "logo": "/logos/tools/workbuddy-cn.png",
  "category": "Agent",
  "tags": [
    "Freemium"
  ],
  "featured": false,
  "developer": "腾讯云",
  "developerZh": "腾讯云",
  "platforms": {
    "web": false,
    "windows": true,
    "macos": true,
    "ios": "unknown",
    "android": "unknown",
    "linux": "unknown",
    "browser_extension": "unknown",
    "api": "unknown"
  }
}
