{
  "slug": "hyperframes",
  "name": "Hyperframes",
  "nameZh": "Hyperframes",
  "description": "编写 HTML，渲染视频。专为 AI 智能体构建的 HTML 转视频渲染引擎。",
  "descriptionEn": "Write HTML. Render video. Built for AI agents. An HTML-to-video rendering engine for AI agents.",
  "descriptionJa": "HTMLを書いて、動画をレンダリング。AIエージェント向けに構築。AIエージェントのためのHTML-to-videoレンダリングエンジン。",
  "descriptionEs": "Escribe HTML. Renderiza video. Construido para agentes de IA. Un motor de renderizado de HTML a video para agentes de IA.",
  "descriptionFr": "Écrivez HTML. Rendezrez la vidéo. Construit pour les agents IA. Un moteur de rendu HTML vers vidéo pour les agents IA.",
  "url": "https://github.com/heygen-com/hyperframes",
  "logo": "/logos/tools/hyperframes.png",
  "category": "Video",
  "tags": [
    "Free",
    "Open Source",
    "API"
  ],
  "featured": false,
  "developer": "HeyGen",
  "developerZh": "HeyGen",
  "platforms": {
    "web": true,
    "windows": false,
    "macos": false,
    "ios": false,
    "android": false,
    "linux": false,
    "browser_extension": false,
    "api": true
  }
}
